{"global":{"folder_must_match_name":true,"forbidden_runtime_prefixes":["claude-","codex-","gemini-","openai-"],"max_length":64,"name_pattern":"^[a-z0-9]+(?:-[a-z0-9]+)*$"},"platforms":{"android":{"allowed_prefixes":["android-"],"canonical_orchestration":"android-orchestration","deprecated":[],"grandfathered":[],"provider_binding":null},"apple":{"allowed_prefixes":["app-store-","apple-","ios-","xcode-"],"canonical_orchestration":"apple-orchestration","deprecated":[],"grandfathered":[],"provider_binding":"analysis.apple"},"backend":{"allowed_prefixes":["backend-"],"canonical_orchestration":"backend-orchestration","deprecated":[],"grandfathered":[],"provider_binding":null},"desktop":{"allowed_prefixes":["desktop-"],"canonical_orchestration":"desktop-orchestration","deprecated":[],"grandfathered":[],"provider_binding":null},"web":{"allowed_prefixes":["web-"],"canonical_orchestration":"web-orchestration","deprecated":[],"grandfathered":[],"provider_binding":null}},"schema_version":"1.0","shared_orchestration":"workflow-orchestration"}
